{
  "apiVersion": 1,
  "id": "wechat-chat",
  "version": "0.2.1",
  "label": "微信聊天记录",
  "locales": {
    "zh": {
      "name": "微信聊天记录"
    },
    "en": {
      "name": "WeChat Chat Export"
    }
  },
  "hosts": [],
  "endpoints": [
    {
      "match": "/nuttle/wechat-chat/chats",
      "label": "微信转发进来的聊天记录（微信「转发 → 其他应用」，已内置解析）"
    },
    {
      "match": "/nuttle/wechat-chat/messages",
      "label": "聊天记录里的消息（已内置解析）"
    }
  ],
  "notes": "微信电脑版 4.1.13 起，多选聊天记录 → 转发 → 其他应用，会导出一个 ZIP（内含 聊天记录.txt）。选囤囤鼠就直接进来（转发入口没开时也可以在控制台导入这个 ZIP 或 txt），由内置模块 wechat_chat 解析后交回 /nuttle/wechat-chat/*，本包解析。只读用户自己导出的文件，不碰微信。"
}
