{
  "apiVersion": 1,
  "id": "xiaohongshu",
  "version": "0.1.0",
  "label": "小红书",
  "locales": {
    "zh": {
      "name": "小红书"
    },
    "en": {
      "name": "Xiaohongshu (RED)"
    }
  },
  "hosts": [
    "*.xiaohongshu.com"
  ],
  "watches": [
    "/api/sns/web/v1/feed",
    "/api/sns/web/v2/comment/page"
  ],
  "noise": [
    "/api/im/web/emoji/config",
    "/api/sec/v1/scripting",
    "/api/im/"
  ],
  "endpoints": [
    {
      "match": "/api/sns/web/v1/feed",
      "label": "笔记详情（正文、图片、互动数据）"
    },
    {
      "match": "/api/sns/web/v2/comment/page",
      "label": "笔记评论分页（已有映射卡）"
    },
    {
      "match": "/api/sec/v1/scripting",
      "label": "风控脚本下发（无业务数据，建议关闭）"
    },
    {
      "match": "/api/im/web/emoji/config",
      "label": "表情包配置，单条可达 700 KB（无业务数据，建议关闭）"
    }
  ],
  "notes": "接口在 edith.xiaohongshu.com。评论在笔记详情页展开评论、翻页时触发；IM 相关接口很杂，表情包配置单条 700 KB，建议关注列表只留 feed 和 comment/page。"
}
