{
  "apiVersion": 1,
  "id": "amazon",
  "version": "0.2.1",
  "label": "Amazon 前台 / Seller Central / 广告后台",
  "locales": {
    "zh": {
      "name": "Amazon 前台 / Seller Central / 广告后台"
    },
    "en": {
      "name": "Amazon storefront / Seller Central / Ads console"
    }
  },
  "hosts": [
    "*.amazon.com"
  ],
  "watches": [],
  "noise": [
    "/cart/add-to-cart/patc-config"
  ],
  "endpoints": [
    {
      "match": "_dom/a-state:desktop-twister-sort-filter-data",
      "label": "商品页变体维度表（ASIN、颜色、尺寸、可售状态，已有映射卡）"
    },
    {
      "match": "/cart/add-to-cart/patc-config",
      "label": "加购按钮配置（无业务数据，建议关闭）"
    }
  ],
  "notes": "商品页数据大多在页面内嵌的 a-state 块里，扩展把它们记成 /dp/<ASIN>/_dom/a-state:<key>；desktop-twister-sort-filter-data 是变体维度表，只有 ASIN / 颜色 / 尺寸 / 可售状态，没有每个变体的价格。"
}
