{
  "apiVersion": 1,
  "id": "wechat-local",
  "version": "0.2.2",
  "label": "微信本地",
  "locales": {
    "zh": {
      "name": "微信收藏 / 聊天记录"
    },
    "en": {
      "name": "WeChat Favorites / Chats"
    }
  },
  "hosts": [],
  "endpoints": [
    {
      "match": "/nuttle/wechat-local/favorites",
      "label": "微信收藏（读取本机微信数据，只读，已内置解析）"
    },
    {
      "match": "/nuttle/wechat-local/chats",
      "label": "关注 / 读入的会话（读取本机微信数据，只读，已内置解析）"
    },
    {
      "match": "/nuttle/wechat-local/messages",
      "label": "关注 / 读入的会话消息（读取本机微信数据，只读，已内置解析）"
    }
  ],
  "notes": "和代理采集不同的另一条路径：读取这台电脑上的微信数据（只读），不改动微信。由内置原生模块 wechat_local 读取后交回 /nuttle/wechat-local/*，本包解析。默认关闭，在「平台 → 微信」里开启。仅 Windows。"
}
