{
  "apiVersion": 1,
  "id": "instagram",
  "version": "0.1.0",
  "label": "Instagram",
  "locales": {
    "zh": {
      "name": "Instagram"
    },
    "en": {
      "name": "Instagram"
    }
  },
  "hosts": [],
  "endpoints": [
    {
      "match": "/nuttle/instagram/posts",
      "label": "Instagram 帖子（「Instagram 帖子与评论」插件整理后交回，已内置解析）"
    },
    {
      "match": "/nuttle/instagram/comments",
      "label": "Instagram 评论（「Instagram 帖子与评论」插件整理后交回，已内置解析）"
    }
  ],
  "notes": "Instagram 网页的数据在 GraphQL 接口（有时一次多行 JSON）和页面内嵌 JSON 里，结构常变，评论里也没有帖子短码。由配套插件 nuttle.instagram 按特征找出帖子与评论，交回 /nuttle/instagram/posts 与 /nuttle/instagram/comments，再由本包两张卡解析。帖子 id 用短码，与官方 Instagram 插件资源对上。样本是示例值，还没有用真实浏览核对过。"
}
