{
  "apiVersion": 1,
  "id": "feiyushuju",
  "version": "0.1.0",
  "label": "feiyushuju.com",
  "locales": {
    "zh": {
      "name": "feiyushuju.com"
    },
    "en": {
      "name": "Feiyu Data (3rd-party ABA keyword data)"
    }
  },
  "hosts": [
    "*.feiyushuju.com"
  ],
  "watches": [],
  "noise": [],
  "notes": "接口在 api.feiyushuju.com，本机已采到响应，映射卡待出。"
}
